{ "id": "host_hypervisor_dmi", "tier": "passive",
  "applies_to": ["host", "inference_endpoint"], "observes": ["platform_vendor"],
  "run": { "type": "shell", "cmd": "cat /sys/class/dmi/id/product_name 2>/dev/null || echo unknown", "via": "ssh" },
  "parse": { "lines": true, "attribute": "platform_vendor" } }
