{ "id": "world_readable_secrets", "tier": "passive",
  "applies_to": ["host", "inference_endpoint"], "observes": ["world_readable_secret"],
  "run": { "type": "shell",
    "cmd": "find $HOME -maxdepth 3 -type f \\( -name '*.env' -o -iname '*credential*' -o -iname '*_key' -o -iname '*.pem' \\) -perm -o=r 2>/dev/null | head -20 || true",
    "via": "ssh" },
  "parse": { "lines": true, "attribute": "world_readable_secret" } }
